{
  "warrant_id": "W-004",
  "tenant_id": "tenant-c",
  "incident_type": "ransomware",
  "time_window": {
    "start": "2025-05-01T00:00:00Z",
    "end": "2025-05-03T23:59:59Z"
  },
  "authorised_evidence_types": [
    "cloudtrail_management"
  ],
  "legal_authority": {
    "order_number": "CRT-2025-004",
    "jurisdiction": "India"
  },
  "requesting_entity": "CBI Cyber Division"
}